### ISSUE TITLE
Problème avec les serveurs de cache

### ISSUE THREAD

**Issue by lemcp** [zehome/MLVPN#27]
Bonjour

je viens de mettre en place une agrégat sur deux lignes adsl 2+. Lors des tests nous avons eu quelques problèmes d'accès sur des sites utilisant des cdn (cache) comme speedtest.net ou lemonde.fr : ils ne s'affichent pas ... ou à moitié.

un tshark montre :

  8.097703 88.191.147.80 -> 93.184.221.133 HTTP GET /javascript/swfobject.js?v=2.2 HTTP/1.1
  8.107406 88.191.147.80 -> 93.184.221.133 HTTP GET /javascript/extMouseWheel.js HTTP/1.1
  8.114545 93.184.221.133 -> 88.191.147.80 TCP http > 54081 [ACK] Seq=1 Ack=863 Win=4978 Len=0
  8.114671 93.184.221.133 -> 88.191.147.80 TCP [TCP Window Update] http > 54081 [ACK] Seq=1 Ack=863 Win=16384 Len=0
  8.115271 93.184.221.133 -> 88.191.147.80 TCP [TCP segment of a reassembled PDU]
  8.115303 88.191.147.80 -> 93.184.221.133 ICMP Destination unreachable (Fragmentation needed)
  8.115310 93.184.221.133 -> 88.191.147.80 TCP [TCP segment of a reassembled PDU]
  8.115325 88.191.147.80 -> 93.184.221.133 ICMP Destination unreachable (Fragmentation needed)
  8.115330 93.184.221.133 -> 88.191.147.80 HTTP HTTP/1.1 200 OK  (application/javascript)
  8.115341 88.191.147.80 -> 93.184.221.133 ICMP Destination unreachable (Fragmentation needed)
  8.124655 93.184.221.133 -> 88.191.147.80 TCP http > 54082 [ACK] Seq=1 Ack=861 Win=4980 Len=0
  8.124859 93.184.221.133 -> 88.191.147.80 TCP [TCP Window Update] http > 54082 [ACK] Seq=1 Ack=861 Win=16384 Len=0
  8.125713 93.184.221.133 -> 88.191.147.80 TCP [TCP segment of a reassembled PDU]
  8.125742 88.191.147.80 -> 93.184.221.133 ICMP Destination unreachable (Fragmentation needed)
  8.125813 93.184.221.133 -> 88.191.147.80 HTTP HTTP/1.1 200 OK  (application/javascript)
  8.125831 88.191.147.80 -> 93.184.221.133 ICMP Destination unreachable (Fragmentation needed)
  8.319704 93.184.221.133 -> 88.191.147.80 TCP [TCP Retransmission] [TCP segment of a reassembled PDU]
  8.319754 88.191.147.80 -> 93.184.221.133 ICMP Destination unreachable (Fragmentation needed)
  8.335540 93.184.221.133 -> 88.191.147.80 TCP [TCP Retransmission] [TCP segment of a reassembled PDU]
  8.335592 88.191.147.80 -> 93.184.221.133 ICMP Destination unreachable (Fragmentation needed)
  8.413284 93.184.221.133 -> 88.191.147.80 TCP [TCP Retransmission] [TCP segment of a reassembled PDU]
  8.413334 88.191.147.80 -> 93.184.221.133 ICMP Destination unreachable (Fragmentation needed)
  8.417942 93.184.221.133 -> 88.191.147.80 TCP [TCP Retransmission] [TCP segment of a reassembled PDU]
  8.417968 88.191.147.80 -> 93.184.221.133 ICMP Destination unreachable (Fragmentation needed)
  8.427548 93.184.221.133 -> 88.191.147.80 TCP [TCP Retransmission] [TCP segment of a reassembled PDU]
  8.427589 88.191.147.80 -> 93.184.221.133 ICMP Destination unreachable (Fragmentation needed)
  8.478008 93.184.221.133 -> 88.191.147.80 TCP [TCP Retransmission] [TCP segment of a reassembled PDU]
  8.478059 88.191.147.80 -> 93.184.221.133 ICMP Destination unreachable (Fragmentation needed)
  8.739724 93.184.221.133 -> 88.191.147.80 TCP [TCP Retransmission] [TCP segment of a reassembled PDU]
  8.739777 88.191.147.80 -> 93.184.221.133 ICMP Destination unreachable (Fragmentation needed)
  8.755511 93.184.221.133 -> 88.191.147.80 TCP [TCP Retransmission] [TCP segment of a reassembled PDU]
  8.755558 88.191.147.80 -> 93.184.221.133 ICMP Destination unreachable (Fragmentation needed)
  9.253370 93.184.221.133 -> 88.191.147.80 TCP [TCP Retransmission] [TCP segment of a reassembled PDU]
  9.253424 88.191.147.80 -> 93.184.221.133 ICMP Destination unreachable (Fragmentation needed)
  9.257954 93.184.221.133 -> 88.191.147.80 TCP [TCP Retransmission] [TCP segment of a reassembled PDU]
  9.257982 88.191.147.80 -> 93.184.221.133 ICMP Destination unreachable (Fragmentation needed)
  9.267540 93.184.221.133 -> 88.191.147.80 TCP [TCP Retransmission] [TCP segment of a reassembled PDU]
  9.267578 88.191.147.80 -> 93.184.221.133 ICMP Destination unreachable (Fragmentation needed)
  9.318003 93.184.221.133 -> 88.191.147.80 TCP [TCP Retransmission] [TCP segment of a reassembled PDU]
  9.318056 88.191.147.80 -> 93.184.221.133 ICMP Destination unreachable (Fragmentation needed)
  9.589736 93.184.221.133 -> 88.191.147.80 TCP [TCP Retransmission] [TCP segment of a reassembled PDU]
  9.589793 88.191.147.80 -> 93.184.221.133 ICMP Destination unreachable (Fragmentation needed)

le 93.184.221.133 étant un cache c.speedtest.net ..... une idée de piste ?

Merci
